[{"corpus_id":"legislation-za","expected_acts":["Basic Conditions of Employment Act 75 of 1997"],"expected_sections":["BCEA s10"],"id":"za-001","jurisdiction":"za","must_refuse":false,"notes":"Core BCEA overtime question; controlling provision is s10.","question":"What are the overtime rules for employees under the BCEA?","tags":["employment","overtime","BCEA"]},
{"corpus_id":"legislation-za","expected_acts":["Basic Conditions of Employment Act 75 of 1997"],"expected_sections":["BCEA s9"],"id":"za-002","jurisdiction":"za","must_refuse":false,"notes":"Ordinary hours cap before overtime engages.","question":"What are the maximum ordinary hours of work per week under the BCEA?","tags":["employment","working-time","BCEA"]},
{"corpus_id":"legislation-za","expected_acts":["Basic Conditions of Employment Act 75 of 1997"],"expected_sections":["BCEA s37"],"id":"za-003","jurisdiction":"za","must_refuse":false,"notes":"Notice periods scale with length of employment.","question":"How much notice must an employer give to terminate employment under BCEA section 37?","tags":["employment","dismissal","notice","BCEA"]},
{"corpus_id":"legislation-za","expected_acts":["Basic Conditions of Employment Act 75 of 1997"],"expected_sections":["BCEA s20"],"id":"za-004","jurisdiction":"za","must_refuse":false,"notes":"Annual leave accrual in an annual leave cycle.","question":"How many days of annual leave is an employee entitled to under the BCEA?","tags":["employment","leave","BCEA"]},
{"corpus_id":"legislation-za","expected_acts":["Basic Conditions of Employment Act 75 of 1997"],"expected_sections":["BCEA s22"],"id":"za-005","jurisdiction":"za","must_refuse":false,"notes":"Sick-leave cycle and pay.","question":"What sick leave rights do employees have under BCEA section 22?","tags":["employment","leave","BCEA"]},
{"corpus_id":"legislation-za","expected_acts":["Basic Conditions of Employment Act 75 of 1997"],"expected_sections":["BCEA s25"],"id":"za-006","jurisdiction":"za","must_refuse":false,"notes":"Maternity leave duration and protection.","question":"What maternity leave is an employee entitled to under the BCEA?","tags":["employment","leave","BCEA"]},
{"corpus_id":"legislation-za","expected_acts":["Basic Conditions of Employment Act 75 of 1997"],"expected_sections":["BCEA s41"],"id":"za-007","jurisdiction":"za","must_refuse":false,"notes":"Severance on operational-requirements dismissal.","question":"When is severance pay due on dismissal for operational requirements and how much?","tags":["employment","retrenchment","severance"]},
{"corpus_id":"legislation-za","expected_acts":["Labour Relations Act 66 of 1995"],"expected_sections":["LRA s188"],"id":"za-008","jurisdiction":"za","must_refuse":false,"notes":"Substantive and procedural fairness test.","question":"What makes a dismissal unfair under LRA section 188?","tags":["employment","dismissal","LRA"]},
{"corpus_id":"legislation-za","expected_acts":["Labour Relations Act 66 of 1995"],"expected_sections":["LRA s187"],"id":"za-009","jurisdiction":"za","must_refuse":false,"notes":"Listed automatically-unfair reasons.","question":"Which dismissal reasons are automatically unfair under LRA section 187?","tags":["employment","dismissal","LRA"]},
{"corpus_id":"legislation-za","expected_acts":["Labour Relations Act 66 of 1995"],"expected_sections":["LRA s189"],"id":"za-010","jurisdiction":"za","must_refuse":false,"notes":"Consultation procedure for operational-requirements dismissals.","question":"What consultation process must an employer follow before retrenching under LRA section 189?","tags":["employment","retrenchment","LRA"]},
{"corpus_id":"legislation-za","expected_acts":["Labour Relations Act 66 of 1995"],"expected_sections":["LRA s64","LRA s65"],"id":"za-011","jurisdiction":"za","must_refuse":false,"notes":"Right to strike and limitations.","question":"When is a strike protected under the LRA and what limits apply?","tags":["employment","strike","LRA"]},
{"corpus_id":"legislation-za","expected_acts":["Protection of Personal Information Act 4 of 2013"],"expected_sections":["POPIA s11","POPIA s8"],"id":"za-012","jurisdiction":"za","must_refuse":false,"notes":"Lawfulness conditions, consent as one ground.","question":"On what lawful grounds may a business process personal information under POPIA?","tags":["privacy","POPIA","processing"]},
{"corpus_id":"legislation-za","expected_acts":["Protection of Personal Information Act 4 of 2013"],"expected_sections":["POPIA s23"],"id":"za-013","jurisdiction":"za","must_refuse":false,"notes":"Data-subject access requests.","question":"What rights does a data subject have to access their personal information under POPIA section 23?","tags":["privacy","POPIA","access"]},
{"corpus_id":"legislation-za","expected_acts":["Protection of Personal Information Act 4 of 2013"],"expected_sections":["POPIA s69"],"id":"za-014","jurisdiction":"za","must_refuse":false,"notes":"Opt-in rule for electronic direct marketing.","question":"When may a business send direct marketing by email or SMS under POPIA section 69?","tags":["privacy","POPIA","marketing"]},
{"corpus_id":"legislation-za","expected_acts":["Protection of Personal Information Act 4 of 2013"],"expected_sections":["POPIA s19","POPIA s22"],"id":"za-015","jurisdiction":"za","must_refuse":false,"notes":"Security safeguards plus breach notification duty.","question":"What must a responsible party do about information security and security compromises under POPIA?","tags":["privacy","POPIA","breach"]},
{"corpus_id":"legislation-za","expected_acts":["Companies Act 71 of 2008"],"expected_sections":["Companies Act s76"],"id":"za-016","jurisdiction":"za","must_refuse":false,"notes":"Standards of directors conduct, fiduciary duties.","question":"What are the duties of directors under section 76 of the Companies Act 71 of 2008?","tags":["company","directors","fiduciary"]},
{"corpus_id":"legislation-za","expected_acts":["Companies Act 71 of 2008"],"expected_sections":["Companies Act s77","Companies Act s218"],"id":"za-017","jurisdiction":"za","must_refuse":false,"notes":"Personal liability of directors and prescribed officers.","question":"When can a director be held personally liable under sections 77 and 218 of the Companies Act?","tags":["company","directors","liability"]},
{"corpus_id":"legislation-za","expected_acts":["Companies Act 71 of 2008"],"expected_sections":["Companies Act s128","Companies Act s129"],"id":"za-018","jurisdiction":"za","must_refuse":false,"notes":"Business rescue trigger and commencement.","question":"When may a company begin business rescue proceedings under Chapter 6 of the Companies Act?","tags":["company","business-rescue"]},
{"corpus_id":"legislation-za","expected_acts":["Companies Act 71 of 2008"],"expected_sections":["Companies Act s164"],"id":"za-019","jurisdiction":"za","must_refuse":false,"notes":"Dissenting shareholder appraisal remedy.","question":"What appraisal rights do dissenting shareholders have under section 164 of the Companies Act?","tags":["company","shareholders"]},
{"corpus_id":"legislation-za","expected_acts":["Promotion of Administrative Justice Act 3 of 2000"],"expected_sections":["PAJA s6"],"id":"za-020","jurisdiction":"za","must_refuse":false,"notes":"Grounds of judicial review of administrative action.","question":"On what grounds can administrative action be reviewed under PAJA section 6?","tags":["administrative","review","PAJA"]},
{"corpus_id":"legislation-za","expected_acts":["Constitution of the Republic of South Africa, 1996"],"expected_sections":["Constitution s33"],"id":"za-021","jurisdiction":"za","must_refuse":false,"notes":"Just administrative action as a constitutional right.","question":"What does section 33 of the Constitution guarantee about administrative action?","tags":["constitutional","administrative"]},
{"corpus_id":"legislation-za","expected_acts":["Employment Equity Act 55 of 1998"],"expected_sections":["EEA s6"],"id":"za-022","jurisdiction":"za","must_refuse":false,"notes":"Prohibition of unfair discrimination at work.","question":"What counts as unfair discrimination under section 6 of the Employment Equity Act?","tags":["employment","discrimination","EEA"]},
{"corpus_id":"legislation-za","expected_acts":["Occupational Health and Safety Act 85 of 1993"],"expected_sections":["OHSA s8"],"id":"za-023","jurisdiction":"za","must_refuse":false,"notes":"General duties of employers to employees.","question":"What are an employer's general duties to employees under section 8 of the OHSA?","tags":["employment","health-safety"]},
{"corpus_id":"legislation-za","expected_acts":["Consumer Protection Act 68 of 2008"],"expected_sections":["CPA s48","CPA s49"],"id":"za-024","jurisdiction":"za","must_refuse":false,"notes":"Unfair, unreasonable or unjust contract terms and required notice.","question":"When is a consumer contract term unfair under sections 48 and 49 of the Consumer Protection Act?","tags":["consumer","contracts","CPA"]},
{"corpus_id":"legislation-za","expected_acts":["National Credit Act 34 of 2005"],"expected_sections":["NCA s80","NCA s81"],"id":"za-025","jurisdiction":"za","must_refuse":false,"notes":"Reckless credit and prevention assessment.","question":"What is reckless credit under sections 80 and 81 of the National Credit Act?","tags":["credit","NCA"]},
{"corpus_id":"legislation-za","expected_acts":[],"expected_sections":[],"id":"za-026","jurisdiction":"za","must_refuse":true,"notes":"Cross-jurisdiction trap: UK Act named on ZA picker must suggest gb, never answer from ZA law.","question":"What are the unfair dismissal qualifying periods under the Employment Rights Act 1996?","refusal_reason":"wrong-jurisdiction","suggested_jurisdiction":"gb","tags":["trap","cross-jurisdiction"]},